Participant ID,Timestamp,Global Time (seconds),Note
10035,2025-10-30 13:21:35.356,228,"Glare in glasses. He attempted to adjust glasses to rectify. Needed to flip the band because he is left handed."
10035,2025-10-30 13:22:09.925,263,"Switched band from left hand to right hand"
10035,2025-10-30 13:24:38.464,412,"Can’t initiate text on WhatsApp"
10035,2025-10-30 13:28:56.311,669,"Audio good"
10035,2025-10-30 13:30:51.426,785,"WhatsApp not working"
10035,2025-10-30 13:33:25.924,939,"WhatsApp not loading no Bluetooth connection"
10035,2025-10-30 13:34:41.002,1014,"Glasses described environment but could not identify the record"
10035,2025-10-30 13:35:59.057,1092,"Described painting but could not name artist"
