Participant ID,Timestamp,Global Time (seconds),Note
1073,2025-12-11 09:51:12.937,55,"Participant is wearing standard glasses but they feel a little too big for her face."
1073,2025-12-11 09:56:49.794,392,"Participant states you don’t really know what you’re recording with the older glasses. Prefers to be able to see media in the display before sending."
1073,2025-12-11 10:02:13.558,715,"Glasses fell down to the bridge of participant’s nose when she adjusted her hair because they are slightly too large."
1073,2025-12-11 10:06:32.884,975,"Participant states she heard a tone that sounded like she received a message. Said “hey Meta read the message” but Meta said there were no new messages. Checked phone and saw multiple new messages."
1073,2025-12-11 10:12:15.456,1317,"Participant states there was more eye strain yesterday during the Lego task and she believes it was due to the glare on the pictures she was trying to view in the display."
1073,2025-12-11 10:20:55.828,1838,"Participant started session on grey couch. Stayed there for first 30 minutes aside from getting up to take a few videos and pictures. Has now moved to light green chair."
1073,2025-12-11 10:21:57.924,1900,"Participant closed eyes while asking questions for about a minute."
