Participant ID,Timestamp,Global Time (seconds),Note
1062,2025-12-04 15:57:29.811,1253,"PT noted glasses being lighter on their face"
1062,2025-12-04 16:00:19.903,1423,"PT has to repeat “hey meta” several time to to get it listen"
1062,2025-12-04 16:28:35.897,3119,"Missed questionnaire"
1062,2025-12-04 16:32:31.410,3355,"No eye strain, headache, or fatigue"
1062,2025-12-04 16:40:52.042,3856,"Had to ask meta a couple times to get Spotify to work"
1062,2025-12-04 16:44:02.586,4046,"When listening music loudly, PT is having trouble replying to messages verbally"
1062,2025-12-04 17:11:32.430,5696,"Meta wouldn’t give PT traffic conditions"
