Participant ID,Timestamp,Global Time (seconds),Note
3010,2026-01-26 12:28:37.998,195,"Had to switch neural band prior to start of session, as another participant needed a size 2 due to larger wrist size. Only available neural bands were size 1 and size 2, and since other participant needed size 2, switched to size 1. Participant states this size is still comfortable. ID: 306GC9SH4Q002Q"
3010,2026-01-26 12:31:34.013,371,"Participant notes some latency when navigating menus and trying to send images. States the watch will buzz but then won’t actually do anything."
3010,2026-01-26 12:37:17.856,715,"Zooming in and out is rather finicky. When he presses it it often stops the video or if he is able to zoom, he lets go of the finger gesture and it still stops the video."
3010,2026-01-26 12:41:25.985,963,"Participant attempted to view picture in the gallery before sending but the picture wouldn’t load."
3010,2026-01-26 12:56:53.337,1890,"Participant states user interface is intuitive and simplistic. Notes that the simplicity is neither a good or bad thing."
3010,2026-01-26 12:59:44.638,2061,"Participant states after Meta AI times out, it doesn’t notice that he is talking to it afterwards even though it seems to be available for questions on the Meta AI screen."
3010,2026-01-26 13:21:42.255,3379,"Participant experiences issues scrolling after Meta AI displays an answer. The visual display is stuck and will not allow participant to scroll either up or down to get to the answer."
