Participant ID,Timestamp,Global Time (seconds),Note
1077,2026-01-13 13:31:02.895,128,"In the car driving. User opened up Instagram and is scrolling reels on the MR display."
1077,2026-01-13 13:41:08.241,734,"User is focusing gaze on the dash."
1077,2026-01-13 13:43:09.908,855,"Black cloth interior in the car."
1077,2026-01-13 13:49:35.091,1241,"User is switching from watching reels on the MR Display to the phone."
1077,2026-01-13 13:51:17.611,1343,"User has the phone on the lap and is looking down at the phone screen."
