Participant ID,Timestamp,Global Time (seconds),Note
1015,2025-11-19 15:20:09.121,343,"For watching the YouTube videos , the sound is through the glasses. User is able to send messages while watching. It pauses the video and then gets back to playing after. The same principle applies for an incoming message."
1015,2025-11-19 15:39:25.277,1499,"The process of messaging while watching a video seemed smooth by observation. User was focused on the video."
1015,2025-11-19 15:56:05.478,2499,"User seems well engaged in the scavenger hunt."
1015,2025-11-19 16:12:30.373,3484,"Meta stopped responding at a point. Had to reconnect and then it worked"
1015,2025-11-19 16:23:27.976,4142,"The audio call disconnected at a point. Bluetooth disconnected. Disconnecting & reconnecting WhatsApp didn’t solve it. After restarting the phone, user could hear it ring through the glasses but couldn’t hear the voice come through."
1015,2025-11-19 16:30:58.360,4592,"Couldn’t successfully hold an audio call through the glasses. The phone call audio switched to regular phone sound when the call starts. This does not necessarily disconnect the actual Bluetooth connection between the phone and the device. Watching other videos seemed fine except the call."
1015,2025-11-19 16:32:13.105,4667,"Switched device to box #9"
1015,2025-11-19 16:33:14.542,4728,"Switched device to box #9 because there were issues with the audio call on the previous device through WhatsApp as noted earlier."
