Participant ID,Timestamp,Global Time (seconds),Note
2001,2025-11-04 08:32:16.922,410,"Display position could potentially feel tiring as one eye is more focused than the other"
2001,2025-11-04 08:36:37.252,670,"Missed questions due to technical difficulties with task"
2001,2025-11-04 08:40:56.646,930,"Participant notes that head positioning is comfortable at all levels and does not change screen clarity"
2001,2025-11-04 08:47:49.397,1342,"Participant notes that the glasses are not transcribing every word, skips many words when audio is too quick"
2001,2025-11-04 08:52:18.195,1611,"Live transcription seems pointless as it creates two points of focus between glasses (live captioning) and watching external video. Meaningful eye shifting happening, per participant"
2001,2025-11-04 08:53:22.988,1676,"Participant notes that this task could cause increased mental fatigue"
2001,2025-11-04 08:56:04.786,1838,"Participant notices that audio transcription is quicker when audio is muffled by dominant hand"
