Participant ID,Timestamp,Global Time (seconds),Note
2001,2025-11-06 09:43:26.351,631,"Video taken with glasses has to be less than 15 seconds to send"
2001,2025-11-06 09:45:43.971,769,"Tried to send pic and it failed"
2001,2025-11-06 09:47:51.512,896,"Sending failed"
2001,2025-11-06 09:49:17.305,982,"Delay in sending the message- older messages coming though now picture"
2001,2025-11-06 09:49:28.251,993,"Video has come through"
2001,2025-11-06 09:50:06.123,1031,"All images now showing up gallery in Meta app"
2001,2025-11-06 09:56:43.310,1428,"Did not get most recent message on what’s app"
