Participant ID,Timestamp,Global Time (seconds),Note
2003,2025-11-13 10:31:02.875,196,"Participant prompted meta to send a message. It automatically brought him to the messages screen from the YouTube video."
2003,2025-11-13 10:32:11.883,265,"Meta automatically opens WhatsApp app whenever he gives what’s app related prompts or commands. He must tell meta to navigate back to YouTube after sending messages."
2003,2025-11-13 10:32:57.244,310,"Participant began to send a message but meta interrupted him, he said “I’m not finished” and was able to continue dictating message."
2003,2025-11-13 10:33:50.719,364,"Meta was unable to send the message, again prompted meta to dictate and send video and was able to this time."
2003,2025-11-13 10:35:03.725,437,"Notes that it’s not getting the last part of his message. Often misses the last word of his dictation. First time it just missed last word and he noticed, but the second time meta noted that it missed part of his message. Then he fixed it and was able to send it on the third attempt."
2003,2025-11-13 10:36:15.635,509,"Participant has to manually navigate back to YouTube after sending messages through voice dictation."
2003,2025-11-13 10:43:16.759,930,"Glasses feel ok."
2003,2025-11-13 10:44:51.761,1025,"Participant tends to use the phone more than voice commands (for example, navigating back to YouTube and pressing play)."
2003,2025-11-13 10:45:20.932,1054,"Participant continues to ask questions without issue."
2003,2025-11-13 10:47:52.981,1206,"Participant prompts meta three times in a row to begin dictating response. Noted that he had to prompt it three times because it messed up."
2003,2025-11-13 10:48:26.484,1239,"Asked meta what was the last message from moderator. Meta replied it cant filter by contact to check messages."
2003,2025-11-13 10:49:56.662,1330,"Asked meta to show the message history. asked meta to show new messages. Asked again to show new messages. Both times stated no new messages on the last minute. Notes that it’s getting an attitude now. Asked meta to show the page that shows messages, said it can’t filter by content."
2003,2025-11-13 10:51:10.552,1404,"Participant navigated to WhatsApp to look for messages. Asked Meta to take him back to YouTube, Meta said it can’t answer that but is learning more every day."
2003,2025-11-13 10:52:29.679,1483,"Note that YouTube app is not installed, so YouTube was playing on Safari. Participant had to open Safari to continue watching video."
2003,2025-11-13 10:53:26.922,1540,"Notes that sometimes when he says “Send” it doesn’t send, then he has to say “Yes” to confirm."
2003,2025-11-13 10:53:52.649,1566,"Noted that sometimes it seems like the AI is getting annoyed with him and making “smart” comments."
2003,2025-11-13 10:59:37.792,1911,"Participant started on grey couch for first task. At this point, participant is walking around and asking questions."
2003,2025-11-13 10:59:59.028,1932,"Asked Meta what is 1+1, answered correctly."
2003,2025-11-13 11:00:25.463,1958,"Asked meta to describe a book and then for information about an author. Meta gave information."
2003,2025-11-13 11:03:32.701,2146,"Started to send message, but I informed him it wasn’t necessary for this session. Had to dictate “No” twice to Meta to let it know he was no longer interested in sending message. Asked meta to return to talking about book, Meta kept asking about message. Participant stated he did not want to send a message. Meta stated it needed “clear content”"
2003,2025-11-13 11:04:20.097,2193,"Asked meta what he was looking at, Meta stated information about picture."
2003,2025-11-13 11:04:48.027,2221,"Meta took a picture of living room without him asking."
2003,2025-11-13 11:05:31.604,2265,"Asked Meta to describe what he was looking at. Meta described vinyl records but participant notes that it doesn’t give information as specific as the title."
2003,2025-11-13 11:06:06.496,2299,"Asked Meta to describe who the singers on the album are. Meta stated Chad & Jeremy. Album name was Chad & Jeremy."
2003,2025-11-13 11:07:34.932,2388,"Asked Meta to describe Chad & Jeremy. Meta gave information. Then participant asked “Can you tell me about Jeremy”. Gave some information including last name and current whereabouts."
2003,2025-11-13 11:09:59.559,2533,"Asked meta 2 * 10 plus 3/4 -37. Meta said it order of operations. But participant notes that earlier in the week it got a problem wrong because it didnt follow order of operations."
2003,2025-11-13 11:11:05.818,2599,"Asked Meta to tell him about Mediterranean Sea. Asked Meta to tell him about Adriatic Sea. Asked Meta what are the Balkans and stated that he never really understood it. Meta gave a few sentences of responses for each question. Participant stated it has given good answers."
2003,2025-11-13 11:11:22.179,2615,"Participant sat down on the light green chair."
2003,2025-11-13 11:12:37.690,2691,"Asked Meta what type of music they listen to in Croatia. Meta gave an answer. Asked what type of music they listen to in Albania. Meta answered again. Participant said “it’s doing good”"
2003,2025-11-13 11:13:36.403,2749,"Asked Meta how many continents are on the earth. It gave a correct answer. Asked meta “what if I moved to Greenland would I be too cold.” He stated meta responded yes which surprised him because he thought it would’ve responded with temperatures."
2003,2025-11-13 11:14:04.193,2777,"Asked meta what is the price of gold today and what would be a good investment for him. Meta stated gold is very high today and that it can’t give personalized financial advice."
2003,2025-11-13 11:14:54.859,2828,"Asked Meta how is the s&p. Meta gave an answer. Asked “So is that bad?” Said essentially that it’s down and gave a bunch of numbers."
2003,2025-11-13 11:16:48.442,2941,"Asked Meta to take a picture of the wall and asked what the bottom picture within the wall picture is. Asked “hey meta are you still awake?” Then asked again what the bottom picture is about. Meta is not able to recognize picture."
2003,2025-11-13 11:17:37.610,2991,"Asked meta what a good weekend activity would be for him. Meta responded suggesting mountains or lakes."
2003,2025-11-13 11:18:16.406,3029,"Asked Meta how to make tamales. States that it gave a good answer about how to make tamales in general."
2003,2025-11-13 11:18:57.793,3071,"Asked Meta how to cook a turkey for thanksgiving. Meta gave step by step instructions. Gave information specific to the weight of the turkey."
2003,2025-11-13 11:20:19.194,3152,"Asked “hey meta, what is this quantum physics thing?” Meta gave an answer. Asked meta to explain more as if he was a third grader. Said “hey meta can I quote you on that that it’s like magic” etc. meta clarified that it didn’t mean magic, it meant something mysterious or out of a fantasy."
2003,2025-11-13 11:21:05.607,3199,"Asked meta what the weather is in phoenix, AZ today. At first didn’t respond. Participant thinks it may not have heard him. So asked again and meta gave an answer."
2003,2025-11-13 11:21:57.972,3251,"Asked Meta what is a popular dinner in Canada. Meta stated poutine or boxed Mac and cheese. Then he asked if they have meat in their diet. Meta explained."
2003,2025-11-13 11:24:35.371,3408,"Asked Meta if he can go to Canada without a passport. Meta stated he could use an enhanced ID card for land or sea travel. Participant asked if he used enhanced ID card could he get back into US. Meta stated it would be preferable to have a passport. Asked Meta what if he did that and came back with correct documents and ICE grabbed him. Meta gave an answer about differing statuses."
2003,2025-11-13 11:25:48.843,3482,"Participant tends to hold the phone up to his face while talking to glasses as if on video call."
2003,2025-11-13 11:26:41.883,3535,"Asked “hey meta are you getting tired because you’re not responding” after it did not give an answer on history of southern Arizona. meta said it was functioning properly. Participant asked again about history of Southern Arizona and Meta answered."
2003,2025-11-13 11:27:44.563,3598,"Asked meta about food prices today in Russia, Meta noted that they are cheaper than the US."
2003,2025-11-13 11:28:29.759,3643,"Asked Meta if Crimea is a good country to visit, Meta gave information and advised looking at UK advisories. Then asked what a good country would be to visit, Meta noted Japan or New Zealand because they are unforgettable experiences."
2003,2025-11-13 11:28:58.203,3671,"Asked Meta what is the smallest lake in Spain. Had to ask twice. Gave an answer."
2003,2025-11-13 11:29:49.417,3722,"Asked meta how to fix car if it has a blown head gasket. Meta gave general answer but advised participant to consult an expert."
2003,2025-11-13 11:32:04.896,3858,"Prompted Meta to call moderator. At first could not hear him, but then was able to."
