Participant ID,Timestamp,Global Time (seconds),Note
1092,2026-01-19 09:18:28.747,164,"Participant states “it’s weird” to see the display there."
1092,2026-01-19 09:21:06.001,321,"Participant paired glasses and neural band. Going through tutorials."
1092,2026-01-19 09:34:05.383,1100,"Participant states it’s weird getting used to the display."
1092,2026-01-19 09:38:26.334,1361,"Participant states in the tutorial there was a screen where the instructions stated to swipe right, but he actually had to swipe left to get to the desired page."
1092,2026-01-19 09:48:52.391,1987,"Participant states it’s much easier and clearer when he looks at the dark background of the TV than the light background behind the TV."
