Participant ID,Timestamp,Global Time (seconds),Note
1037,2025-11-13 13:09:14.083,408,"Participant notices that Meta voice sounds more robotic than previous session"
1037,2025-11-13 13:16:46.006,860,"Participant could not tell if audio could be heard by moderators in the room or just themselves"
1037,2025-11-13 13:17:52.816,927,"Participant notices that image quality is not clear when capturing text"
1037,2025-11-13 13:21:48.218,1162,"Participant testing image quality by capturing image of cup with embossed pattern and is impressed when discovering that it could be seen"
1037,2025-11-13 13:26:42.812,1457,"Participant believes that glasses could be useful in situations where user needs to record potentially dangerous situations"
