Participant ID,Timestamp,Global Time (seconds),Note
1037,2025-11-13 08:58:33.438,126,"Participant assumed they should take glasses out of case as first step in pairing process until instructions instructed otherwise"
1037,2025-11-13 09:01:27.166,300,"Participant’s inclination was to skip instructions for how to control gen2 glasses"
1037,2025-11-13 09:03:19.117,412,"Participant was surprised by camera capturing capabilities suggested to try by Meta in set up instructions"
1037,2025-11-13 09:04:34.803,487,"Participant is unsure if motion controls they are performing on glasses are working or not and says they “can’t tell”"
1037,2025-11-13 09:08:59.983,753,"Participant finds tutorials clear and helpful"
