Participant ID,Timestamp,Global Time (seconds),Note
1038,2025-11-20 13:00:43.137,155,"Participant says they’re not usually susceptible to car sickness"
1038,2025-11-20 13:03:04.807,297,"Participant notices that screen quality improves as they look toward different colored backgrounds. Participant is not looking at road since they say they cannot see MR display clearly"
1038,2025-11-20 13:08:16.801,609,"Participant’s focus is 50/50 on the road and on MR display"
1038,2025-11-20 13:11:28.495,800,"Participant is happy with positioning of screen in MR glasses"
1038,2025-11-20 13:12:31.245,863,"Participant notes that scrolling down motion is less responsive than other scrolling motions"
1038,2025-11-20 13:15:52.754,1064,"Handedness of neural band is particularly important as participant is left handed and settings for band were geared toward right hand. Neural band was not as responsive until switch."
1038,2025-11-20 13:32:42.727,2074,"Participant does not notice any glare or rainbow effect in the glasses and says lenses are clear under different lighting conditions"
