Participant ID,Timestamp,Global Time (seconds),Note
1029,2025-12-01 10:59:30.680,955,"In the beginning of the protocol we had to switch the devices from the ones we placed for pre questions."
1029,2025-12-01 11:00:27.624,1012,"The out of the box experience took about 10 minutes rather than the 45 minutes the was ask."
1029,2025-12-01 11:07:11.711,1416,"During prof all the participant is noticing that the display is very light so they have to be looking at a dark display."
1029,2025-12-01 11:12:30.559,1734,"The participant is navigating through the game very well, one thing that could change would be that the not all hand movements are not registering all movements."
1029,2025-12-01 11:15:51.342,1935,"Once we moved around the room, pertinent noticed a more difficult time seeing the visuals due to the light reflecting and lack of dark background."
1029,2025-12-01 11:18:10.126,2074,"Participant doesn’t automatically recognize that hand can be in any position."
