Participant ID,Timestamp,Global Time (seconds),Note
1019,2025-11-19 12:26:46.921,186,"Participant had trouble sending photos using the “Hey Meta” feature."
1019,2025-11-19 12:29:29.952,349,"Participant discovered the “Hey Meta” command would only send the most recent photo not the two most recent photos."
1019,2025-11-19 13:29:14.569,3934,"Glasses keep disconnecting from the Wi-Fi"
1019,2025-11-19 13:29:34.088,3953,"Meta is struggling to pickup PTs voice"
1019,2025-11-19 13:31:26.292,4065,"PT has to repeat mods name several times to get it to understand"
1019,2025-11-19 13:35:21.716,4301,"Disconnected from Wi-Fi again"
1019,2025-11-19 14:02:43.130,5942,"PT noted that meta will keep rambling if you don’t cut it off"
