Participant ID,Timestamp,Global Time (seconds),Note
1021,2025-11-13 13:01:26.906,454,"While taking the pictures on the glasses kept doing off of the network."
1021,2025-11-13 13:09:00.000,907,"There would be a better way to importing media in order import. You would have to wait for participant to be done recording. Rather that an auto syncing."
1021,2025-11-13 13:13:48.815,1196,"There should be a clear timer for how many seconds you have recorded."
1021,2025-11-13 13:14:58.161,1266,"Participant is experiencing a slight bit of disorientation while watching the video with the glasses."
1021,2025-11-13 13:17:13.608,1401,"The images seem to have. Slight bit of filtering blur to when you view them on the phone."
1021,2025-11-13 13:19:41.858,1549,"While watching the YouTube videos earlier in the session the volume was much better then. Listening back to video recordings."
1021,2025-11-13 13:21:54.153,1682,"The pressure on the ears while wearing the glasses seems to be stagnant through the exercises."
1021,2025-11-13 13:24:25.252,1833,"The participant is experiencing ocular convergence while watching media on the screen."
1021,2025-11-13 13:28:38.745,2086,"The audio seems to be more muffed, when hearing meta speak."
