Participant ID,Timestamp,Global Time (seconds),Note
1070,2025-12-11 09:27:29.450,216,"Switched glasses in the beginning of session due to issue the original pair not pairing. 

New pair- 4V37W31H8S0295"
1070,2025-12-11 09:29:01.304,308,"A note from the participant was that the mic proximity worked very well."
1070,2025-12-11 09:59:21.874,2129,"While asking meta questions, meta was having a hard time answering the right questions."
1070,2025-12-11 10:10:59.613,2827,"It would be great to have a transparent mode."
