Participant ID,Timestamp,Global Time (seconds),Note
1085,2026-01-21 14:05:13.470,441,"While taking the pictures through meta band. Participant had to repeat commands in order for meta to do it."
1085,2026-01-21 14:54:05.341,3373,"Missed the last two responses

30 & 40 - the participant says the the symptoms have not changed in the last few minute from responses in 50min survey."
1085,2026-01-21 14:58:45.363,3653,"The brightness levels are making it much harder to see the screen."
1085,2026-01-21 14:59:26.150,3694,"The participant is stating that they have to squint there left eye to see the visual better."
1085,2026-01-21 15:15:44.400,4672,"The missed surveys was added as screen shots on cloud from under
 “30 min survey” and “40 min Survey”"
1085,2026-01-21 15:45:08.731,6436,"It became more cloudy, outside which made it easier for the participant to see the display."
1085,2026-01-21 15:50:07.781,6736,"Participant was able to build all 6 Lego Dino’s as well and re build 3 extra."
1085,2026-01-21 15:52:43.216,6891,"The participant is creating the Dino’s in a much faster rate then most participants."
1085,2026-01-21 15:54:51.785,7020,"Participant states that the color looks great on the meta display. as well is impressed with how true the colors come out."
