Participant ID,Timestamp,Global Time (seconds),Note
1026,2025-11-20 12:50:20.949,675,"While on the drive, participant is noticing a very distinguishable glare."
1026,2025-11-20 12:52:32.337,806,"Participant had to take two painkillers at the end of the last protocol due to a bad headache."
1026,2025-11-20 12:55:28.400,982,"In order to see the display properly on the glasses participant had to be looking the floor,  which creates an extra level of uncomfortably."
1026,2025-11-20 13:00:23.403,1277,"In order focus on the display with the glasses you would have to have a dark background. while in the car, it is hard to find a dark area."
1026,2025-11-20 13:02:32.344,1406,"In the beginning of the session we had to switch out the kit for kit number 9, this indicate the glasses and meta band has changed from the devices used in session 1."
1026,2025-11-20 13:05:58.378,1612,"After 20 minutes into the drive, the pain in the neck is staying consistent during the drive, due to looking down."
1026,2025-11-20 13:12:09.237,1983,"While the transitional lenses have darkened, the picture quality stayed the same. The glasses should be able to have a much better experience which a darker lens so the participant dose not have to be looking for a darker area."
1026,2025-11-20 13:13:36.978,2071,"Participant, prefers the gen 2 audio quality over the one with the display."
