Participant ID,Timestamp,Global Time (seconds),Note
1026,2025-11-19 09:53:34.366,191,"EyeQ crashed after 40 minutes in the study, lux measurements and response's are all accurate."
1026,2025-11-19 10:06:47.498,984,"There is no noticeable discomfort so far."
1026,2025-11-19 10:17:21.697,1618,"The sound quality on the headphones are very clear and much better on the gen 2 glasses over the first generation."
1026,2025-11-19 10:21:55.926,1893,"Having meta adjust the volume up and down or take a picture with a voice. Is great for individuals for are going to have their hands full."
1026,2025-11-19 10:34:24.324,2641,"While talking, the gen 2 glasses would not announce the message it just did a *Ding and then lowered the volume."
1026,2025-11-19 10:40:04.719,2981,"The design is modern and sleek it is hard  to tell they have cameras."
1026,2025-11-19 10:44:05.511,3222,"There are many times that meta does not notify participant about a message."
