Participant ID,Timestamp,Global Time (seconds),Note
1006,2025-11-12 14:56:08.440,211,"Glasses are on, wristband is on, glasses aren’t connected"
1006,2025-11-12 14:59:42.048,425,"Glasses connected"
1006,2025-11-12 15:09:20.434,1003,"Display flickers in the light but when she moved her gaze it was back to normal"
1006,2025-11-12 15:11:32.861,1136,"Screen and voice are delayed. Could be connection issues outside."
1006,2025-11-12 15:29:13.944,2197,"Participant noticed that Meta gets “stuck” on previous question or information request"
1006,2025-11-12 15:34:45.442,2528,"Getting dizzy from the glasses. Took a seat from exploring outside"
