Participant ID,Timestamp,Global Time (seconds),Note
1006,2025-11-13 10:53:59.291,102,"Expo mod restarted session to properly pair glasses, previous session was only 1-2 minutes"
1006,2025-11-13 10:56:04.329,227,"Pt successfully sends text while watching YouTube video"
1006,2025-11-13 10:57:56.332,339,"Pt is able to text successfully by using meta ai without saying the full contact name. Was able to say first name only and still worked"
1006,2025-11-13 10:59:38.515,441,"Pt asked meta to text mod an smiling face emoji, and it did not send. Meta replied “that’s a lot of smiles”"
1006,2025-11-13 11:01:09.682,533,"Pt asked meta to text moderator “how are you” and meta replied as if being asked the question. Also had to confirm to send twice"
1006,2025-11-13 11:03:29.930,673,"Pt describes the experience as a bit overstimulating as while asking meta to send a text the audio is overlapping with any current video playing making it slightly hard to focus. Pt wishes it would lower the video volume or silence it while meta spoke"
1006,2025-11-13 11:05:38.072,801,"Pt is able to get meta to send pictures while watching a video and was glad it it stopped the video for it"
