Participant ID,Timestamp,Global Time (seconds),Note
3012,2026-01-27 10:14:35.976,306,"Participant described images sent in WhatsApp as unidentifiable blobs when viewing them in glasses. Pt had to exit chat and then re-enter to allow images to load clearly"
3012,2026-01-27 10:16:23.790,413,"Using glasses: 2Y0YW13H58002V"
3012,2026-01-27 10:17:59.277,509,"Participant sent an image to a contact in WhatsApp using the share icon in the glasses gallery app but was unaware that image had actually been sent"
3012,2026-01-27 10:18:44.130,554,"Participant says they heard a whoosh noise as if the image was sent but did not receive any verbal or visual confirmation which confused them"
3012,2026-01-27 10:31:24.685,1314,"Participant describes screen clarity as “horrible” in the sun"
3012,2026-01-27 10:33:10.155,1420,"Participant says that in the shade, it’s much better but busy backdrops are distracting. Looking at bright objects lessens screen clarity as if brightness has been turned down"
