Participant ID,Timestamp,Global Time (seconds),Note
1060,2025-11-19 11:37:31.960,139,"Participant states music started playing and he had to stop it manually."
1060,2025-11-19 11:38:35.076,202,"Participant is able to take pictures and record videos."
1060,2025-11-19 11:39:02.529,229,"Participant said “stop recording” then said “hey Meta stop”."
1060,2025-11-19 11:42:06.408,413,"Participant said “hey Meta send the last video to Stephanie”. Mets had participant confirm and then said “this might take a minute”. Participant received message from Stephanie and Meta read it automatically ."
1060,2025-11-19 11:44:08.600,535,"Participant took 3 images using “hey meta take a picture” command. Tried to send last three images to moderator but Meta said could only send one message at once, so participant amended command to send one image, Meta sent image."
