Participant ID,Timestamp,Global Time (seconds),Note
1071,2025-12-08 17:10:26.902,638,"For the capture and share task, the video recording froze at a point when the user tried to move their head around. Also meta kept sending a previously recorded video instead of an updated one."
1071,2025-12-08 17:16:05.768,977,"Meta sent photos and videos that were initially taken but at a point it just stopped sending the media files. Some of the files would show up in the meta app but were not sent through WhatsApp."
1071,2025-12-08 17:17:06.325,1037,"It appears that the files are not shared until they uploaded in the meta app."
1071,2025-12-08 17:24:37.195,1488,"Capturing media through the glasses with the band worked fine. However, the files were not being shared on WhatsApp maybe because of the internet. Files were visible through the meta app , waiting to be imported into the gallery."
1071,2025-12-08 17:27:24.023,1655,"The glasses froze again while the video was being recorded."
