Participant ID,Timestamp,Global Time (seconds),Note
3007,2026-01-06 11:01:44.158,531,"Instagram was having an having an issue with loading up the content. When we first opened the application."
3007,2026-01-06 11:03:55.735,663,"It took a while for instagram reels to load up."
3007,2026-01-06 11:05:00.796,728,"There was an issue in the beginning connecting Instagram to the glasses. It his connectivity issue took 4 min to fix."
3007,2026-01-06 11:06:49.343,837,"While watching the instagram videos there are time. Where the video takes 10-20 seconds to load the video. But would freeze right after."
3007,2026-01-06 11:09:58.568,1026,"While looking the videos on Instagram the participant states that it is hard to read the texts on the videos due to sizing issue."
