Participant ID,Timestamp,Global Time (seconds),Note
3007,2026-01-08 10:50:16.996,338,"Hey Meta struggled to catch a name that is more unique, user had to change the WhatsApp contact name to a nickname so that Meta could send the media."
3007,2026-01-08 10:52:01.677,442,"User likes the display of the other glasses model, although it would be nice to turn it on and off."
3007,2026-01-08 10:52:50.163,491,"User says that video and photo quality is really good."
3007,2026-01-08 10:58:06.583,807,"The glasses are more responsive and quicker."
3007,2026-01-08 10:58:24.541,825,"“Feels like meta is more with you than the other glasses probably because it has less to process”"
3007,2026-01-08 10:58:55.087,856,"User leans in very closely to items when taking a picture."
3007,2026-01-08 11:01:34.044,1015,"Glasses take photos in a .5x lens similar to the other glasses “which is good because it gets more”."
3007,2026-01-08 11:03:56.444,1157,"User is using the phone to check the quality of the photos being taken and sent."
