Participant ID,Timestamp,Global Time (seconds),Note
3007,2026-01-05 11:54:38.153,535,"Participant was having a hard understanding the beginning instructions"
3007,2026-01-05 12:06:29.411,1246,"We missed me first question due to participant having a hard time reading and understanding the questions in Time."
3007,2026-01-05 12:24:32.421,2329,"The set up process is taking a longer time than usually."
3007,2026-01-05 12:27:18.268,2495,"We chose to switch device after pair 39 min after 10 min of pairing issues."
3007,2026-01-05 12:31:47.700,2764,"We had to switch out the pair of glasses again after the same pairing issue. 

Pairing issue is that the glasses did not stop blinking and never connected to phone. Even after glasses and band were factory reset."
