Participant ID,Timestamp,Global Time (seconds),Note
1005,2025-11-05 15:45:59.474,177,"Asked device how airplanes fly. Explained well."
1005,2025-11-05 15:46:32.949,211,"Asked most popular show on Netflix. Meta said the Witcher and stranger things."
1005,2025-11-05 15:47:48.949,287,"Asked meta the top rated off-road trail in Arizona. Meta gave an answer related to the Witcher. Asked again, this time specifically asking for top rated off-road trail in phoenix. Meta replied bulldog trail."
1005,2025-11-05 15:48:36.783,335,"Asked meta what is the mechanism of a headache. Gave a satisfactory answer about increased stimulation of pain receptors in the brain."
1005,2025-11-05 15:51:16.517,494,"Asked meta what is the picture he is looking at. It said 3 different posters, most famous being starry night. Asked who is depicted in second photo, but meta continued to answer about starry night. Again asked who is depicted in photo, referring to middle photo. Meta continued  to answer about Starry Night."
