Participant ID,Timestamp,Global Time (seconds),Note
1005,2025-11-04 10:09:36.489,431,"Participant saw meta logo and saw menu for a second, but then was unable to execute any commands with neural band. Had participant restart neural band with no success."
1005,2025-11-04 10:12:58.864,633,"Participant was able to repair and begin watching video."
1005,2025-11-04 10:13:39.403,674,"Participant was promoted to choose language on phone."
1005,2025-11-04 10:16:22.417,837,"Participant is now able to see captions on phone."
1005,2025-11-04 10:17:04.925,879,"Captions have gotten a few things wrong but then it corrects itself."
1005,2025-11-04 10:19:21.540,1016,"When the word is incorrect it typically realizes before the word is fully displayed and corrects the word displayed on the screen."
1005,2025-11-04 10:19:44.634,1039,"The dictation does not pick up the participant speaking, only words from the video playing."
1005,2025-11-04 10:21:28.836,1143,"When the person on the video begins to speak in Russian, the dictation did not display captions for those words in Russian. It kept up in English. Russian language has not been downloaded."
