Participant ID,Timestamp,Global Time (seconds),Note
1104,2026-01-26 12:42:03.551,721,"The user/PT initially skipped the instructions , their initial instinct was just put on the glasses. They also had trouble identifying the button on the glasses and to visualize where the LED screen would blink from ."
1104,2026-01-26 12:43:47.029,825,"The user/ PT also had trouble identifying the power button of the band. But with assistance , we were able to get the device setup."
1104,2026-01-26 12:44:20.730,858,"Device setup was done in about 12 min."
1104,2026-01-26 12:52:34.997,1352,"The user / PT had difficulty with some of the hand gestures. They had to go through the tutorials again."
1104,2026-01-26 12:54:15.602,1453,"Even with the volume turned all the way up , they had difficulty hearing possibly they must have had some hearing loss."
1104,2026-01-26 13:24:06.434,3244,"The user / PT mentioned they would have preferred to have the screen in the glasses centered."
1104,2026-01-26 13:39:12.627,4150,"The user / PT mentioned they felt a bit of uneasiness with the glasses but that wasn't the case when they were focused on something with the glasses eg playing a game , making a call. They said “uneasy” to do with the screen not being so clear especially with the different backgrounds."
1104,2026-01-26 13:54:40.008,5078,"I noticed the user / PT would occasionally adjust the glasses as though it was slipping off their nose bridge."
1104,2026-01-26 14:30:00.235,7198,"Mentioned the glasses were a bit heavy,"
