Participant ID,Timestamp,Global Time (seconds),Note
1104,2026-01-28 14:01:56.102,405,"Closed captioning didn’t work on the glasses / phone (#9) . We were unable to download the languages unto the Captions as required by the glasses. We used the alternative - had the user / PT watch the video on a different device + message on WhatsApp ."
1104,2026-01-28 14:08:55.344,824,"The meta voice command picked up the external sound ( from the different device ) as part of the message being sent. The user / PT had to reduce the volume on the external device to prevent that from happening."
1104,2026-01-28 14:19:47.667,1477,"The user / PT mentioned that with doing the alternative , they were unable to focus on the video."
1104,2026-01-28 14:31:14.696,2164,"User / PT mentioned that they liked how the meta ai emphasizes and puts feelings into what is being described or read in response to a question."
1104,2026-01-28 14:32:42.748,2252,"By observation , I could tell the user / PT really enjoys the meta ai scavenger hunt task."
1104,2026-01-28 15:10:03.202,4492,"The user/ PT mentioned the color discrimination ( for the Lego task ) was better inside compared to being outside ."
1104,2026-01-28 15:43:30.382,6499,"The user / PT mentioned that while doing the Lego task (outdoors) the previous day, they were not aware they could select the photos in WhatsApp making it appear larger and that must have been why they struggled to see the images and mentioned that it was difficult to see which we initially interpreted as not being clear enough. Today , for same Lego task (indoors) the user / PT did not have that issue. They were able to see much clearer , and seemed more relaxed and comfortable following the instructions to put the pieces together."
1104,2026-01-28 15:47:03.895,6713,"The user / PT took off the glasses for a second to rub their eyes."
