Participant ID,Timestamp,Global Time (seconds),Note
1078,2026-01-12 13:10:16.490,889,"Glasses pair #10 ending in 002V did not pair . The device was not detectable although the LED was pulsing white. We have switched to pair #11 - 2Y0YW14H590011"
1078,2026-01-12 13:19:26.813,1440,"Once we switched the glasses pair , the use was able to get the device setup fast enough."
1078,2026-01-12 13:20:46.522,1519,"During the hypertrail game , the user mentioned it was more difficult to move in a the top /down direction. The left/right was smooth enough."
1078,2026-01-12 14:10:35.189,4508,"During the meta scavenger hunt , the display box was blank for a while when the user asked for a translation, a green dot popped up and it didn’t give a response for a while."
1078,2026-01-12 14:17:20.655,4913,"The user enjoyed the video call experience . The sound quality and display was good."
