Participant ID,Timestamp,Global Time (seconds),Note
3014,2026-01-29 14:22:23.354,70,"User is wearing gen 2 glasses and is instructed on the activity, capturing photos and sending it to moderator"
3014,2026-01-29 14:23:30.351,137,"User walks next to dark green armchair and captures a photo, is able to send it to moderator in the same command, only having to confirm it when meta requests"
3014,2026-01-29 14:24:11.766,178,"User repeats ‘send last photo’ to moderator multiple times, has to move to a different place in the room to get good connectivity"
3014,2026-01-29 14:25:19.031,245,"User has taken and sent 6 photos so far, but upon opening WhatsApp, only two were actually sent to moderator"
3014,2026-01-29 14:26:32.025,318,"User is being asked multiple times by meta if they want to sent a specific photo, user has already confirmed it 5 times and has to open WhatsApp on phone to check if they got sent."
3014,2026-01-29 14:37:04.663,951,"User is seated on couch leaning downwards as they capture photos and send it to moderator"
3014,2026-01-29 14:38:09.243,1015,"User is having to repeat yes multiple times to confirm sending photo to moderator, causing frustration to user."
3014,2026-01-29 14:40:07.795,1134,"User is having to repeat ‘Yes’ multiple times to send photo to moderator"
3014,2026-01-29 14:41:52.127,1238,"User is seated on dark coffee table, facing the TV, taking various photos to moderator"
