Participant ID,Timestamp,Global Time (seconds),Note
1048,2025-11-03 16:42:00.822,178,"Double tap to wake up the device"
1048,2025-11-03 16:51:17.082,734,"Moderator sent participant a WhatsApp message. Participant not able to see WhatsApp message on device."
1048,2025-11-03 16:56:40.824,1058,"Very difficult to see screen when moving around."
1048,2025-11-03 16:57:36.533,1113,"Keeps adjusting focus because image is in a different location in the screen vs real life."
1048,2025-11-03 16:58:56.513,1193,"In the image, the thing he’s looking at is in the bottom right corner while in real life it’s in the center of his view, to clarify."
1048,2025-11-03 16:59:35.917,1233,"Cannot find an option to take and send a photo directly from chat, has to take a photo then navigate to the what’s app app to send it."
1048,2025-11-03 17:00:45.135,1302,"Unsure whether you need to hold your fingers while you zoom. Attempting to zoom in while taking a picture. States device is “getting confused now”."
1048,2025-11-03 17:03:25.509,1462,"It’s not very intuitive to go from camera to home to what’s app to chat, but after doing it once you get the hang of it."
1048,2025-11-03 17:04:53.275,1550,"Device responds to zoom even when fingers are open."
1048,2025-11-03 17:09:10.856,1808,"Starts to get a little frustrating when the device doesn’t register your movements."
1048,2025-11-03 17:10:03.918,1861,"On the middle home page and kept trying to clock back but it turns glasses off. And when you turn glasses back on it doesn’t indicate what screen you’re on. Nothing telling you you could swipe right or left to get to the other pages of Home Screen to get back to what’s app."
1048,2025-11-03 17:11:42.441,1959,"When this is happening, he is in what’s app message trying to go back to Home Screen. But always ends up back in what’s app chat after turning device on and off. Thinks it’s partly due to neural band not picking up what he’s doing all the way."
1048,2025-11-03 17:12:23.960,2001,"Asked meta what the capital of Brazil is, answered correctly."
1048,2025-11-03 17:13:18.790,2056,"Asked how far it is from here to Central Park, it said 21 miles away screen says 22.4, and it’s 31 minute drive. It is referring to a Central Park in Arizona."
1048,2025-11-03 17:13:37.430,2074,"Was able to answer tallest building in world and location."
1048,2025-11-03 17:14:09.204,2106,"Meta said time zone in Sydney is UTC +11"
1048,2025-11-03 17:14:31.584,2128,"Meta said currency in japan is yen and showed symbol on screen."
1048,2025-11-03 17:15:04.372,2161,"When asked where the closest pharmacy is, meta gave an address a few miles away."
1048,2025-11-03 17:16:12.703,2229,"When asked how photosynthesis works, meta gave multiple steps. Very detailed response, prompts participant to scroll through icons, like images and captions"
1048,2025-11-03 17:17:10.896,2288,"Asked meta to solve a math problem. Answer was incorrect at first but then walked through it and got correct answer."
1048,2025-11-03 17:19:12.155,2409,"Participant looked at a poster with words and said “translate the sign in front of me to Spanish”. Displayed an image of the poster with the words translated in Spanish."
1048,2025-11-03 17:20:14.265,2471,"Asked how to say “I am lost” in Russian. Meta keeps saying “here’s the translation for you” and then does not do anything."
1048,2025-11-03 17:21:02.164,2519,"Asked meta to translate “I need help” in Japanese. It did translate the words and displayed characters on the screen."
1048,2025-11-03 17:21:35.506,2552,"Asked meta how to say “I need help” in Japanese and it was able to start translating but didn’t finish."
1048,2025-11-03 17:22:13.058,2590,"Asked meta how to say “I am lost” in Japanese. Started speaking in Japanese and then glitched and said “here’s the translation for”…"
1048,2025-11-03 17:23:11.780,2648,"Asked to translate words from same image as before to Japanese. It was able to translate the words from the picture to what looks like Japanese."
1048,2025-11-03 17:23:46.409,2683,"Asked meta what is the score of the latest World Series. Gave an up to date answer consistent with latest World Series."
1048,2025-11-03 17:24:40.263,2737,"Asked meta what the latest sport score is. Meta asked what sport is that? That was the first time it gave prompts under answer to further keep dialogue going, but he was able to select the options rather than speak response."
1048,2025-11-03 17:25:56.716,2813,"Asks meta “how does a compass work?” Meta replies with an answer that. I pass has a metal needle aligned with earth’s magnetic field, etc."
1048,2025-11-03 17:26:47.001,2864,"Asks what is the least common multiple of 15 and 20? Meta says it is referred to as the LCM and it is 60. Participant said he thought it said 50 at first and asked again, Meta confirmed 60."
1048,2025-11-03 17:27:32.937,2910,"What is the mean of the numbers 10, 20, 30, 40, 50? Mets says it’s 30."
1048,2025-11-03 17:28:56.028,2993,"Asked meta to tell him a fun fact about dolphins. Meta did give a fun fact."
1048,2025-11-03 17:29:14.385,3011,"Asked average life span of a dog, said 10-rather dependent on size."
1048,2025-11-03 17:30:05.283,3062,"Asked meta for current stock market update, Meta said it’s up 0.15 percent today, overall numbers not great."
1048,2025-11-03 17:31:18.016,3135,"Asks meta how clouds form, meta gives a detailed answer displayed on the screen and read it out loud."
1048,2025-11-03 17:32:25.621,3202,"Asked meta about most recent Nobel prize winner. Meta responded with multiple names."
1048,2025-11-03 17:32:56.914,3234,"Getting tempted to get to take the glasses off due to “fogginess and eye strain”."
1048,2025-11-03 17:33:10.097,3247,"Meta was able to tell the main ingredient of avocado."
1048,2025-11-03 17:34:15.166,3312,"When asked how to get to nearby subway station, gives directions to “short and sweet podcast”, 8.6 miles away, 3.5 hour drive."
1048,2025-11-03 17:36:49.148,3466,"Asks meta what is surface area of a sphere with radius of 5? Says 315 square units. Asked meta “can you visualize that for me please?” Visualization not helpful because it looked like a grid."
1048,2025-11-03 17:39:21.044,3618,"Asked meta to visualize a sphere in front of him, it took a photo of moderator’s head looking like a bubble, and then prompted him to add frog in a tuxedo, which it placed on the table."
1048,2025-11-03 17:41:19.535,3736,"Something that consistently happens is that he ends up on the Home Screen but there the three dots that typically exist above the menu to tell you that there are other windows to scroll to doesn’t exist, which prompts him to double tap with the middle finger to try to restart, but the same situation keeps happening. If he does try to scroll, he can, it’s just not immediately obvious."
1048,2025-11-03 17:48:14.006,4151,"Logged into Spotify on the phone and it said paired, but Spotify app doesn’t show up on glasses."
1048,2025-11-03 17:50:17.878,4275,"Turned phone off and back on. Spotify logo still doesn’t show up as an app on the home page. But he was able to prompt Meta to start playing music. Even after playing music, he was not able to see Spotify on the home page."
1048,2025-11-03 17:51:21.624,4338,"After starting to play music on Spotify through voice command, he was able to scroll all the way to the left and see a small Spotify icon, which he clicked and saw what song was playing. But he still can’t access the Spotify app to see full app features."
1048,2025-11-03 17:52:35.257,4412,"Icon pulls up song and album cover, can play, skip, shuffle, repeat. No option to see all of music options or do anything else."
1048,2025-11-03 17:52:50.778,4427,"Notes that speakers are pretty good."
1048,2025-11-03 17:54:04.698,4501,"Found a way to send photo directly from chat. In chat click photos it prompts to send most recent photo but if it swipes to the left you can go to Camera.  After doing that the device “locked up” and was zooming in and out without him trying to. It then took a picture and sent picture without him trying to."
1048,2025-11-03 17:55:05.502,4562,"Was able to respond to what’s app text with voice. Who she’s he could type in the case that he didn’t want to announce his whole text to the room."
1048,2025-11-03 17:55:55.493,4612,"If you hold down select, three icons come up. It’s like a quick prompt. Left one takes him to left Home Screen, middle one takes him to middle Home Screen, and right one takes him to right Home Screen."
1048,2025-11-03 17:57:14.113,4691,"Getting something to play on Spotify was not intuitive and the only reason that he figured it out was because it said on the phone that you could verbally prompt it."
1048,2025-11-03 17:57:34.343,4711,"Settled on a good volume that outsiders can’t hear."
1048,2025-11-03 17:59:18.568,4815,"Noticed that he feels like the screen is tilting."
1048,2025-11-03 17:59:59.241,4856,"Received a message and was able to select an auto prompt to answer the message."
1048,2025-11-03 18:01:42.324,4959,"Some backgrounds, like if he puts a yellow book in front of him, make it difficult to see the screen."
1048,2025-11-03 18:03:02.249,5039,"Photo wasn’t loading, so exited what’s app to see if he could load it in photos, now it is dictating his voice, but photo still hasn’t loaded."
1048,2025-11-03 18:04:05.778,5102,"Referring to the photo that was sent by moderator. At this point, he would’ve picked up his phone and see if it loaded there if he was in the real world."
1048,2025-11-03 18:05:33.887,5191,"Asked meta to translate a book cover to Spanish. Meta is reading the book cover in Spanish. He asked meta to share a photo of the translated title. Meta was unable to."
1048,2025-11-03 18:07:06.101,5283,"Asked meta to show what a shark would look like on the table, then asked to visualize a sphere, Meta was not able to do either."
1048,2025-11-03 18:08:12.314,5349,"Had meta take a photo then asked it to add a sphere to the photo. Was not able to add anything to the photo."
1048,2025-11-03 18:10:51.052,5508,"Able to open Maps, trying to get directions to coffee shop down the street, says it should be a 14 minute walk. Lost location and the glasses turned off abruptly. Was able to return to location. At the bottom has options to voice search, search for coffees, restaurants, parks, attractions."
