Participant ID,Timestamp,Global Time (seconds),Note
3005,2026-01-08 09:14:17.038,139,"When participant tried on standard size glasses, she felt that they were immediately pressing on the sides of her head behind her ears. Switched to glasses #2, size large, immediately before starting session."
3005,2026-01-08 09:16:01.033,243,"Participant starts session on grey couch but walks around to take pictures and images."
3005,2026-01-08 09:20:53.095,535,"Participant states that a few of the times she’s tried to take a photo Meta responds with “ok cancel”. Wonders if it’s because she is moving around too much."
3005,2026-01-08 09:22:46.392,648,"Participant notes no issues with taking and sending videos."
3005,2026-01-08 09:31:12.734,1154,"Participant states she told Meta to take a video but forgot to say “to send to moderator” and Meta prompted her after taking the video by asking who she wanted to send it to."
