Participant ID,Timestamp,Global Time (seconds),Note
2006,2026-01-05 09:12:59.264,194,"Participant scrolled through devices in initial Meta AI setup device menu and found correct device instead of immediately clicking the first device which participants often do"
2006,2026-01-05 09:14:54.711,310,"Although instructions prompted participant to take glasses out of case, participant followed set up instructions without taking glasses out of case"
2006,2026-01-05 09:15:55.610,371,"Although tab had already been pulled from case, participant did not follow through with instructions if tab had already been pulled. I guided participant in correct line of instruction based on tab already being pulled"
2006,2026-01-05 09:16:36.257,411,"Participant was able to successfully pair glasses after following instructions based on tab already being pulled and glasses being taken out of case"
2006,2026-01-05 09:17:21.065,456,"Participant looked at me for help but I encouraged them to reread instructions where they were ultimately successful in making it to next steps"
2006,2026-01-05 09:18:27.592,522,"Participant does not believe instructions were very helpful and described their success in pairing glasses as trial and error"
2006,2026-01-05 09:27:58.260,1093,"Screen was not activating for participant despite neural band being connected and properly fitted and display being connected"
2006,2026-01-05 09:28:25.322,1120,"Participant activated screen using Hey Meta since hand gestures were not responsive"
