Participant ID,Timestamp,Global Time (seconds),Note
1039,2025-12-17 09:17:46.123,90,"Participant starts session in the dark green chair."
1039,2025-12-17 09:18:18.977,123,"Feels like display is very translucent with a glare. Adjusted brightness up and stated that adjusting brightness helped a bit but not a ton."
1039,2025-12-17 09:22:05.862,350,"Participant sits angled towards the right, facing the grey couch with face angled slightly downward to watch reels."
1039,2025-12-17 09:37:50.282,1294,"Participant feels like experience watching reels is pretty similar to watching reels in the car. Notes that it is annoying because there are glare spots around the play buttons and around all the white buttons on the display. The display is very see through even when brightness is all the way up, has to focus to actually see what she’s trying to see. However, the quality of the videos is good."
1039,2025-12-17 09:38:05.641,1310,"Participant moved to grey couch."
1039,2025-12-17 09:40:40.636,1465,"Participant states it is much easier to watch reels on the phone because the phone is much easier to focus on. When she was on the green couch she was focusing eyes on the side of the grey couch as a background, but notes there is still “a lot going on” when focusing on that background."
1039,2025-12-17 09:58:06.148,2510,"Participant has switched to light green chair."
1039,2025-12-17 10:05:11.499,2935,"Participant states that the bright lights cause a glare on the glasses. It makes the display translucent and makes the experience less comfortable. Makes it harder to focus on watching videos."
